{
  "$schema": "https://particlerealms.online/schemas/morphfield/v2/nexel-capabilities.schema.json",
  "schema": "morphfield-nexel-capabilities",
  "version": { "major": 2, "minor": 0 },
  "jsonSchemaDialect": "https://json-schema.org/draft/2020-12/schema",
  "fieldletFamilies": [
    { "id": 0, "name": "analytic" },
    { "id": 1, "name": "sparse-residual" },
    { "id": 2, "name": "oriented-kernel" },
    { "id": 3, "name": "cached-surface" }
  ],
  "queryKinds": ["bound", "surface", "medium", "material", "motion", "collision"],
  "sourceKinds": [
    {
      "kind": "sphere",
      "family": 0,
      "familyName": "analytic",
      "semanticAdmission": true,
      "cpuReference": true,
      "cpuReferenceMode": "complete",
      "compiler": true,
      "compilerMode": "certified-analytic-execution",
      "renderer": "direct-field",
      "potentialQueries": ["bound", "surface", "material", "motion", "collision"],
      "gpuQueries": ["bound", "surface", "material", "motion", "collision"],
      "gpuQueryModes": { "bound": "conservative-bound", "surface": "certified-surface", "medium": "unavailable", "material": "material-table", "motion": "certificate-envelope", "collision": "certified-collision" },
      "limitations": []
    },
    {
      "kind": "box",
      "family": 0,
      "familyName": "analytic",
      "semanticAdmission": true,
      "cpuReference": true,
      "cpuReferenceMode": "complete",
      "compiler": true,
      "compilerMode": "certified-analytic-execution",
      "renderer": "direct-field",
      "potentialQueries": ["bound", "surface", "material", "motion", "collision"],
      "gpuQueries": ["bound", "surface", "material", "motion", "collision"],
      "gpuQueryModes": { "bound": "conservative-bound", "surface": "certified-surface", "medium": "unavailable", "material": "material-table", "motion": "certificate-envelope", "collision": "certified-collision" },
      "limitations": []
    },
    {
      "kind": "capsule",
      "family": 0,
      "familyName": "analytic",
      "semanticAdmission": true,
      "cpuReference": true,
      "cpuReferenceMode": "complete",
      "compiler": true,
      "compilerMode": "certified-analytic-execution",
      "renderer": "direct-field",
      "potentialQueries": ["bound", "surface", "material", "motion", "collision"],
      "gpuQueries": ["bound", "surface", "material", "motion", "collision"],
      "gpuQueryModes": { "bound": "conservative-bound", "surface": "certified-surface", "medium": "unavailable", "material": "material-table", "motion": "certificate-envelope", "collision": "certified-collision" },
      "limitations": []
    },
    {
      "kind": "csg",
      "family": 0,
      "familyName": "analytic",
      "semanticAdmission": true,
      "cpuReference": true,
      "cpuReferenceMode": "complete",
      "compiler": true,
      "compilerMode": "certified-analytic-execution",
      "renderer": "direct-field",
      "potentialQueries": ["bound", "surface", "material", "motion", "collision"],
      "gpuQueries": ["bound", "surface", "material", "motion", "collision"],
      "gpuQueryModes": { "bound": "conservative-bound", "surface": "certified-surface", "medium": "unavailable", "material": "material-table", "motion": "certificate-envelope", "collision": "certified-collision" },
      "limitations": ["Only hard union, intersection, and difference over analytic children are admitted."]
    },
    {
      "kind": "sampled-field",
      "family": 1,
      "familyName": "sparse-residual",
      "semanticAdmission": true,
      "cpuReference": true,
      "cpuReferenceMode": "complete",
      "compiler": true,
      "compilerMode": "certified-field-execution",
      "renderer": "direct-field",
      "potentialQueries": ["bound", "surface", "material", "motion", "collision"],
      "gpuQueries": ["bound", "surface", "material", "motion", "collision"],
      "gpuQueryModes": { "bound": "conservative-bound", "surface": "certified-surface", "medium": "unavailable", "material": "material-table", "motion": "certificate-envelope", "collision": "certified-collision" },
      "limitations": ["Progressive wavefront traversal remains limited to certified analytic-family Fieldlets."]
    },
    {
      "kind": "sparse-residual",
      "family": 1,
      "familyName": "sparse-residual",
      "semanticAdmission": true,
      "cpuReference": true,
      "cpuReferenceMode": "complete",
      "compiler": true,
      "compilerMode": "certified-field-execution",
      "renderer": "direct-field",
      "potentialQueries": ["bound", "surface", "material", "motion", "collision"],
      "gpuQueries": ["bound", "surface", "material", "motion", "collision"],
      "gpuQueryModes": { "bound": "conservative-bound", "surface": "certified-surface", "medium": "unavailable", "material": "material-table", "motion": "certificate-envelope", "collision": "certified-collision" },
      "limitations": ["Progressive wavefront traversal remains limited to certified analytic-family Fieldlets.", "Streamed fine residual pages require the pinned certified coarse fallback before publication."]
    },
    {
      "kind": "oriented-samples",
      "family": 2,
      "familyName": "oriented-kernel",
      "semanticAdmission": true,
      "cpuReference": true,
      "cpuReferenceMode": "source-axis-only",
      "compiler": true,
      "compilerMode": "certificate-record",
      "renderer": "marker-only",
      "potentialQueries": ["bound", "surface", "material", "motion", "collision"],
      "gpuQueries": ["bound", "material", "motion"],
      "gpuQueryModes": { "bound": "conservative-bound", "surface": "unavailable", "medium": "unavailable", "material": "material-table", "motion": "certificate-envelope", "collision": "unavailable" },
      "limitations": [
        "The oriented-kernel integration pass is marker-only.",
        "The CPU reference currently applies anisotropic radii in source axes; stored sample normals do not yet rotate the kernel frame."
      ]
    },
    {
      "kind": "indexed-surface",
      "family": 3,
      "familyName": "cached-surface",
      "semanticAdmission": true,
      "cpuReference": true,
      "cpuReferenceMode": "complete",
      "compiler": true,
      "compilerMode": "packed-marker",
      "renderer": "marker-only",
      "potentialQueries": ["bound", "surface", "material", "motion"],
      "gpuQueries": ["bound", "material", "motion"],
      "gpuQueryModes": { "bound": "conservative-bound", "surface": "unavailable", "medium": "unavailable", "material": "material-table", "motion": "certificate-envelope", "collision": "unavailable" },
      "limitations": ["Validated cached-surface raster publication is not integrated."]
    },
    {
      "kind": "medium",
      "family": 0,
      "familyName": "analytic",
      "semanticAdmission": true,
      "cpuReference": true,
      "cpuReferenceMode": "complete",
      "compiler": true,
      "compilerMode": "certificate-record",
      "renderer": "marker-only",
      "potentialQueries": ["bound", "medium", "motion"],
      "gpuQueries": ["bound", "medium", "motion"],
      "gpuQueryModes": { "bound": "conservative-bound", "surface": "unavailable", "medium": "certificate-majorant", "material": "unavailable", "motion": "certificate-envelope", "collision": "unavailable" },
      "limitations": ["The medium certificate query is implemented; frame integration is marker-only."]
    }
  ],
  "invariants": [
    "Nexel is semantic; execution-family selection is compiler-owned.",
    "Compiler-derived certificates are never accepted from authored JSON.",
    "Binary Fieldlet, certificate, query, and GPU-buffer layouts are ABI contracts rather than JSON instances.",
    "CPU reference result objects and 64-byte GPU query records are distinct contracts; a shared query name does not imply identical result shape.",
    "A marker-only renderer status is not a claim of live family execution.",
    "compilerMode distinguishes certified analytic execution, certified sampled-field execution, certificate-only compilation, and packed markers.",
    "gpuQueryModes declares one explicit mode for every typed query; unavailable is never implied by omission.",
    "fullyGpuExecutable is retained as an exact compatibility alias of fullyCurrentRendererExecutable.",
    "Descriptor inspection reports implementation coverage only; it never claims qualification against a particular GPUDevice."
  ]
}
